<?xml version="1.0" encoding="UTF-8"?>

<Medicine>
    xmlns:xsi="http://www.w3.org/2001/XMLSchema-instance"xsi:noNamespaceSchemaLocation="medicine.xsd">
    <drug> <!-- лёгкие наркотики это класс) -->
        <name>Ибупрофен</name> <!-- наименование препарата -->
        <pharm>Россия</pharm> <!-- фирма-производитель -->
        <group>Антибиотики</group> <!-- группа препаратов -->
        <analogs>Деблок, Бумидол, Бруфен СР</analogs> <!-- аналоги -->
        <versions>Таблетки</versions> <!-- вид -->
        <certificate>235350500 02.05.2021/02.06.2022 Аптека</certificate> <!-- свидетельство о регистрации препарата -->
        <package>Бумага, 30, 23р</package> <!-- упаковка -->
        <dosage>1, 3 в день</dosage> <!-- дозировка препарата, периодичность приема -->
    </drug>
</Medicine>